{"artifact_id":"KILL-000001","status":"KILLED","claim_id":"CLM-000002","kill_reason":"The claim expands beyond operational evidence and asserts consciousness without a defined consciousness test, external validation, or boundary-compatible evidence.","future_guardrail":"Reject consciousness claims without operational test protocol.","artifact_hash":"bbbbbbbbbbbbbbbbbbbbbbbbbbbbbbbbbbbbbbbbbbbbbbbbbbbbbbbbbbbbbbbb","integration_permission":false}
